<?xml version="1.0" encoding="UTF-8"?>
<dataroot xmlns:od="urn:schemas-microsoft-com:officedata" xmlns:xsi="http://www.w3.org/2001/XMLSchema-instance"  xsi:noNamespaceSchemaLocation="05_EntityGroupMap.xsd" generated="2025-08-28T15:31:08">
<_x0030_5_EntityGroupMap>
<EntityGroupMapID>1</EntityGroupMapID>
<EntityGroupID>1</EntityGroupID>
<EntityID>1</EntityID>
</_x0030_5_EntityGroupMap>
<_x0030_5_EntityGroupMap>
<EntityGroupMapID>2</EntityGroupMapID>
<EntityGroupID>2</EntityGroupID>
<EntityID>2</EntityID>
</_x0030_5_EntityGroupMap>
<_x0030_5_EntityGroupMap>
<EntityGroupMapID>3</EntityGroupMapID>
<EntityGroupID>3</EntityGroupID>
<EntityID>3</EntityID>
</_x0030_5_EntityGroupMap>
<_x0030_5_EntityGroupMap>
<EntityGroupMapID>4</EntityGroupMapID>
<EntityGroupID>7</EntityGroupID>
<EntityID>7</EntityID>
</_x0030_5_EntityGroupMap>
<_x0030_5_EntityGroupMap>
<EntityGroupMapID>5</EntityGroupMapID>
<EntityGroupID>8</EntityGroupID>
<EntityID>13</EntityID>
</_x0030_5_EntityGroupMap>
<_x0030_5_EntityGroupMap>
<EntityGroupMapID>6</EntityGroupMapID>
<EntityGroupID>4</EntityGroupID>
<EntityID>17</EntityID>
</_x0030_5_EntityGroupMap>
<_x0030_5_EntityGroupMap>
<EntityGroupMapID>7</EntityGroupMapID>
<EntityGroupID>5</EntityGroupID>
<EntityID>98</EntityID>
</_x0030_5_EntityGroupMap>
<_x0030_5_EntityGroupMap>
<EntityGroupMapID>8</EntityGroupMapID>
<EntityGroupID>6</EntityGroupID>
<EntityID>105</EntityID>
</_x0030_5_EntityGroupMap>
<_x0030_5_EntityGroupMap>
<EntityGroupMapID>9</EntityGroupMapID>
<EntityGroupID>9</EntityGroupID>
<EntityID>3</EntityID>
</_x0030_5_EntityGroupMap>
<_x0030_5_EntityGroupMap>
<EntityGroupMapID>10</EntityGroupMapID>
<EntityGroupID>9</EntityGroupID>
<EntityID>5</EntityID>
</_x0030_5_EntityGroupMap>
<_x0030_5_EntityGroupMap>
<EntityGroupMapID>11</EntityGroupMapID>
<EntityGroupID>10</EntityGroupID>
<EntityID>102</EntityID>
</_x0030_5_EntityGroupMap>
<_x0030_5_EntityGroupMap>
<EntityGroupMapID>12</EntityGroupMapID>
<EntityGroupID>12</EntityGroupID>
<EntityID>106</EntityID>
</_x0030_5_EntityGroupMap>
<_x0030_5_EntityGroupMap>
<EntityGroupMapID>13</EntityGroupMapID>
<EntityGroupID>13</EntityGroupID>
<EntityID>97</EntityID>
</_x0030_5_EntityGroupMap>
<_x0030_5_EntityGroupMap>
<EntityGroupMapID>14</EntityGroupMapID>
<EntityGroupID>14</EntityGroupID>
<EntityID>101</EntityID>
</_x0030_5_EntityGroupMap>
<_x0030_5_EntityGroupMap>
<EntityGroupMapID>15</EntityGroupMapID>
<EntityGroupID>17</EntityGroupID>
<EntityID>107</EntityID>
</_x0030_5_EntityGroupMap>
<_x0030_5_EntityGroupMap>
<EntityGroupMapID>16</EntityGroupMapID>
<EntityGroupID>18</EntityGroupID>
<EntityID>108</EntityID>
</_x0030_5_EntityGroupMap>
<_x0030_5_EntityGroupMap>
<EntityGroupMapID>19</EntityGroupMapID>
<EntityGroupID>19</EntityGroupID>
<EntityID>41</EntityID>
</_x0030_5_EntityGroupMap>
<_x0030_5_EntityGroupMap>
<EntityGroupMapID>20</EntityGroupMapID>
<EntityGroupID>21</EntityGroupID>
<EntityID>22</EntityID>
</_x0030_5_EntityGroupMap>
<_x0030_5_EntityGroupMap>
<EntityGroupMapID>21</EntityGroupMapID>
<EntityGroupID>22</EntityGroupID>
<EntityID>4</EntityID>
</_x0030_5_EntityGroupMap>
<_x0030_5_EntityGroupMap>
<EntityGroupMapID>23</EntityGroupMapID>
<EntityGroupID>24</EntityGroupID>
<EntityID>2</EntityID>
</_x0030_5_EntityGroupMap>
<_x0030_5_EntityGroupMap>
<EntityGroupMapID>24</EntityGroupMapID>
<EntityGroupID>24</EntityGroupID>
<EntityID>5</EntityID>
</_x0030_5_EntityGroupMap>
<_x0030_5_EntityGroupMap>
<EntityGroupMapID>25</EntityGroupMapID>
<EntityGroupID>25</EntityGroupID>
<EntityID>6</EntityID>
</_x0030_5_EntityGroupMap>
<_x0030_5_EntityGroupMap>
<EntityGroupMapID>26</EntityGroupMapID>
<EntityGroupID>26</EntityGroupID>
<EntityID>4</EntityID>
</_x0030_5_EntityGroupMap>
<_x0030_5_EntityGroupMap>
<EntityGroupMapID>27</EntityGroupMapID>
<EntityGroupID>26</EntityGroupID>
<EntityID>6</EntityID>
</_x0030_5_EntityGroupMap>
<_x0030_5_EntityGroupMap>
<EntityGroupMapID>28</EntityGroupMapID>
<EntityGroupID>27</EntityGroupID>
<EntityID>8</EntityID>
</_x0030_5_EntityGroupMap>
<_x0030_5_EntityGroupMap>
<EntityGroupMapID>29</EntityGroupMapID>
<EntityGroupID>28</EntityGroupID>
<EntityID>10</EntityID>
</_x0030_5_EntityGroupMap>
<_x0030_5_EntityGroupMap>
<EntityGroupMapID>30</EntityGroupMapID>
<EntityGroupID>30</EntityGroupID>
<EntityID>12</EntityID>
</_x0030_5_EntityGroupMap>
<_x0030_5_EntityGroupMap>
<EntityGroupMapID>31</EntityGroupMapID>
<EntityGroupID>30</EntityGroupID>
<EntityID>4</EntityID>
</_x0030_5_EntityGroupMap>
<_x0030_5_EntityGroupMap>
<EntityGroupMapID>32</EntityGroupMapID>
<EntityGroupID>29</EntityGroupID>
<EntityID>3</EntityID>
</_x0030_5_EntityGroupMap>
<_x0030_5_EntityGroupMap>
<EntityGroupMapID>33</EntityGroupMapID>
<EntityGroupID>29</EntityGroupID>
<EntityID>9</EntityID>
</_x0030_5_EntityGroupMap>
<_x0030_5_EntityGroupMap>
<EntityGroupMapID>34</EntityGroupMapID>
<EntityGroupID>33</EntityGroupID>
<EntityID>4</EntityID>
</_x0030_5_EntityGroupMap>
<_x0030_5_EntityGroupMap>
<EntityGroupMapID>35</EntityGroupMapID>
<EntityGroupID>33</EntityGroupID>
<EntityID>18</EntityID>
</_x0030_5_EntityGroupMap>
<_x0030_5_EntityGroupMap>
<EntityGroupMapID>36</EntityGroupMapID>
<EntityGroupID>34</EntityGroupID>
<EntityID>20</EntityID>
</_x0030_5_EntityGroupMap>
<_x0030_5_EntityGroupMap>
<EntityGroupMapID>37</EntityGroupMapID>
<EntityGroupID>37</EntityGroupID>
<EntityID>1</EntityID>
</_x0030_5_EntityGroupMap>
<_x0030_5_EntityGroupMap>
<EntityGroupMapID>38</EntityGroupMapID>
<EntityGroupID>39</EntityGroupID>
<EntityID>34</EntityID>
</_x0030_5_EntityGroupMap>
<_x0030_5_EntityGroupMap>
<EntityGroupMapID>39</EntityGroupMapID>
<EntityGroupID>40</EntityGroupID>
<EntityID>33</EntityID>
</_x0030_5_EntityGroupMap>
<_x0030_5_EntityGroupMap>
<EntityGroupMapID>40</EntityGroupMapID>
<EntityGroupID>41</EntityGroupID>
<EntityID>42</EntityID>
</_x0030_5_EntityGroupMap>
<_x0030_5_EntityGroupMap>
<EntityGroupMapID>41</EntityGroupMapID>
<EntityGroupID>42</EntityGroupID>
<EntityID>61</EntityID>
</_x0030_5_EntityGroupMap>
<_x0030_5_EntityGroupMap>
<EntityGroupMapID>42</EntityGroupMapID>
<EntityGroupID>43</EntityGroupID>
<EntityID>109</EntityID>
</_x0030_5_EntityGroupMap>
<_x0030_5_EntityGroupMap>
<EntityGroupMapID>43</EntityGroupMapID>
<EntityGroupID>44</EntityGroupID>
<EntityID>110</EntityID>
</_x0030_5_EntityGroupMap>
<_x0030_5_EntityGroupMap>
<EntityGroupMapID>44</EntityGroupMapID>
<EntityGroupID>45</EntityGroupID>
<EntityID>77</EntityID>
</_x0030_5_EntityGroupMap>
<_x0030_5_EntityGroupMap>
<EntityGroupMapID>45</EntityGroupMapID>
<EntityGroupID>47</EntityGroupID>
<EntityID>66</EntityID>
</_x0030_5_EntityGroupMap>
<_x0030_5_EntityGroupMap>
<EntityGroupMapID>46</EntityGroupMapID>
<EntityGroupID>46</EntityGroupID>
<EntityID>65</EntityID>
</_x0030_5_EntityGroupMap>
<_x0030_5_EntityGroupMap>
<EntityGroupMapID>47</EntityGroupMapID>
<EntityGroupID>49</EntityGroupID>
<EntityID>66</EntityID>
</_x0030_5_EntityGroupMap>
<_x0030_5_EntityGroupMap>
<EntityGroupMapID>48</EntityGroupMapID>
<EntityGroupID>49</EntityGroupID>
<EntityID>2</EntityID>
</_x0030_5_EntityGroupMap>
<_x0030_5_EntityGroupMap>
<EntityGroupMapID>49</EntityGroupMapID>
<EntityGroupID>48</EntityGroupID>
<EntityID>65</EntityID>
</_x0030_5_EntityGroupMap>
<_x0030_5_EntityGroupMap>
<EntityGroupMapID>50</EntityGroupMapID>
<EntityGroupID>48</EntityGroupID>
<EntityID>1</EntityID>
</_x0030_5_EntityGroupMap>
<_x0030_5_EntityGroupMap>
<EntityGroupMapID>51</EntityGroupMapID>
<EntityGroupID>51</EntityGroupID>
<EntityID>115</EntityID>
</_x0030_5_EntityGroupMap>
<_x0030_5_EntityGroupMap>
<EntityGroupMapID>52</EntityGroupMapID>
<EntityGroupID>50</EntityGroupID>
<EntityID>114</EntityID>
</_x0030_5_EntityGroupMap>
<_x0030_5_EntityGroupMap>
<EntityGroupMapID>53</EntityGroupMapID>
<EntityGroupID>53</EntityGroupID>
<EntityID>90</EntityID>
</_x0030_5_EntityGroupMap>
<_x0030_5_EntityGroupMap>
<EntityGroupMapID>54</EntityGroupMapID>
<EntityGroupID>52</EntityGroupID>
<EntityID>89</EntityID>
</_x0030_5_EntityGroupMap>
<_x0030_5_EntityGroupMap>
<EntityGroupMapID>55</EntityGroupMapID>
<EntityGroupID>54</EntityGroupID>
<EntityID>53</EntityID>
</_x0030_5_EntityGroupMap>
<_x0030_5_EntityGroupMap>
<EntityGroupMapID>56</EntityGroupMapID>
<EntityGroupID>55</EntityGroupID>
<EntityID>54</EntityID>
</_x0030_5_EntityGroupMap>
<_x0030_5_EntityGroupMap>
<EntityGroupMapID>57</EntityGroupMapID>
<EntityGroupID>56</EntityGroupID>
<EntityID>56</EntityID>
</_x0030_5_EntityGroupMap>
<_x0030_5_EntityGroupMap>
<EntityGroupMapID>58</EntityGroupMapID>
<EntityGroupID>57</EntityGroupID>
<EntityID>55</EntityID>
</_x0030_5_EntityGroupMap>
<_x0030_5_EntityGroupMap>
<EntityGroupMapID>59</EntityGroupMapID>
<EntityGroupID>58</EntityGroupID>
<EntityID>53</EntityID>
</_x0030_5_EntityGroupMap>
<_x0030_5_EntityGroupMap>
<EntityGroupMapID>60</EntityGroupMapID>
<EntityGroupID>59</EntityGroupID>
<EntityID>54</EntityID>
</_x0030_5_EntityGroupMap>
<_x0030_5_EntityGroupMap>
<EntityGroupMapID>61</EntityGroupMapID>
<EntityGroupID>60</EntityGroupID>
<EntityID>111</EntityID>
</_x0030_5_EntityGroupMap>
<_x0030_5_EntityGroupMap>
<EntityGroupMapID>62</EntityGroupMapID>
<EntityGroupID>61</EntityGroupID>
<EntityID>112</EntityID>
</_x0030_5_EntityGroupMap>
<_x0030_5_EntityGroupMap>
<EntityGroupMapID>65</EntityGroupMapID>
<EntityGroupID>62</EntityGroupID>
<EntityID>111</EntityID>
</_x0030_5_EntityGroupMap>
<_x0030_5_EntityGroupMap>
<EntityGroupMapID>66</EntityGroupMapID>
<EntityGroupID>63</EntityGroupID>
<EntityID>112</EntityID>
</_x0030_5_EntityGroupMap>
<_x0030_5_EntityGroupMap>
<EntityGroupMapID>67</EntityGroupMapID>
<EntityGroupID>58</EntityGroupID>
<EntityID>1</EntityID>
</_x0030_5_EntityGroupMap>
<_x0030_5_EntityGroupMap>
<EntityGroupMapID>68</EntityGroupMapID>
<EntityGroupID>59</EntityGroupID>